{
    "$schema": "../../movie.schema.json",
    "movie": 37,
    "unk02": 3,
    "score_multiplier": 6,
    "cast_count": 1,
    "director": 2,
    "turn_limit": 3,
    "ideal_turn": 3,
    "ending_scene": 3,
    "rule": 1,
    "species": [ -1, -1 ],
    "unk16": -1,
    "trainer_classes": {
        "male": {
            "film": "TRAINER_CLASS_PRESCHOOLER_F",
            "watch": "TRAINER_CLASS_CURSED_KID"
        },
        "female": {
            "film": "TRAINER_CLASS_PRESCHOOLER_F",
            "watch": "TRAINER_CLASS_CURSED_KID"
        }
    },
    "unk20": 0,
    "recorded_trainer_class": "TRAINER_CLASS_GUY",
    "unk24": 799,
    "bgm": "SEQ_BGM_PW_SCENARIO_05_L",
    "win_bgm": "SEQ_BGM_PW_SCENARIO_06_F",
    "unk2a": "SEQ_BGM_PW_SCENARIO_06_L",
    "unk2c": "SEQ_BGM_PW_SCENARIO_08_F",
    "star_level": 3,
    "turn_events": [
        {
            "turn": 0,
            "value": 1055
        },
        {
            "turn": 0,
            "value": -1
        },
        {
            "turn": 0,
            "value": -1
        }
    ],
    "unk3c": [
        [ 627, 0, 65, 0 ],
        [ 628, 0, 60, 0 ],
        [ 652, 2, 55, 0 ],
        [ 0, -1, 0, 0 ],
        [ 0, -1, 0, 0 ],
        [ 0, -1, 0, 0 ]
    ],
    "turn_messages": [
        [ 2, -1, -1, -1, -1, -1, -1, -1, -1, -1, -1, -1, -1, -1, -1, -1, -1, -1, -1, -1 ],
        [ 3, 4, 5, -1, -1, -1, -1, -1, -1, -1, -1, -1, -1, -1, -1, -1, -1, -1, -1, -1 ]
    ],
    "scenes": [
        {
            "turn": 0,
            "unk02": -1,
            "unk04": -1,
            "unk06": -1,
            "reaction": 1,
            "score": 0,
            "messages": [
                [ -1, 7, -1, -1, -1, -1, -1, -1, -1, -1 ],
                [ 6, -1, -1, -1, -1, -1, -1, -1, -1, -1 ]
            ],
            "events": [ 17, -1, -1, -1, -1, -1, -1, -1, -1, -1 ],
            "choices": [
                {
                    "message": 8,
                    "message2": 9,
                    "unk04": 0,
                    "unk06": -1,
                    "points": 0,
                    "unk0a": -1
                },
                {
                    "message": 10,
                    "message2": 11,
                    "unk04": 1,
                    "unk06": -1,
                    "points": 5,
                    "unk0a": -1
                },
                {
                    "message": 12,
                    "message2": 13,
                    "unk04": 3,
                    "unk06": -1,
                    "points": -5,
                    "unk0a": -1
                },
                {
                    "message": -1,
                    "message2": -1,
                    "unk04": -1,
                    "unk06": -1,
                    "points": 0,
                    "unk0a": -1
                }
            ]
        },
        {
            "turn": 1,
            "unk02": -1,
            "unk04": -1,
            "unk06": -1,
            "reaction": 1,
            "score": 0,
            "messages": [
                [ -1, 15, -1, -1, -1, -1, -1, -1, -1, -1 ],
                [ 14, -1, -1, -1, -1, -1, -1, -1, -1, -1 ]
            ],
            "events": [ 17, -1, -1, -1, -1, -1, -1, -1, -1, -1 ],
            "choices": [
                {
                    "message": 16,
                    "message2": 17,
                    "unk04": 0,
                    "unk06": -1,
                    "points": -5,
                    "unk0a": -1
                },
                {
                    "message": 18,
                    "message2": 19,
                    "unk04": 2,
                    "unk06": -1,
                    "points": 0,
                    "unk0a": -1
                },
                {
                    "message": 20,
                    "message2": 21,
                    "unk04": 1,
                    "unk06": -1,
                    "points": 5,
                    "unk0a": -1
                },
                {
                    "message": -1,
                    "message2": -1,
                    "unk04": -1,
                    "unk06": -1,
                    "points": 0,
                    "unk0a": -1
                }
            ]
        },
        {
            "turn": 2,
            "unk02": -1,
            "unk04": -1,
            "unk06": -1,
            "reaction": 1,
            "score": 0,
            "messages": [
                [ -1, 23, -1, -1, -1, -1, -1, -1, -1, -1 ],
                [ 22, -1, -1, -1, -1, -1, -1, -1, -1, -1 ]
            ],
            "events": [ 17, -1, -1, -1, -1, -1, -1, -1, -1, -1 ],
            "choices": [
                {
                    "message": 24,
                    "message2": 25,
                    "unk04": -1,
                    "unk06": -1,
                    "points": 0,
                    "unk0a": -1
                },
                {
                    "message": 26,
                    "message2": 27,
                    "unk04": 1,
                    "unk06": -1,
                    "points": 5,
                    "unk0a": -1
                },
                {
                    "message": 28,
                    "message2": 29,
                    "unk04": -1,
                    "unk06": -1,
                    "points": 0,
                    "unk0a": -1
                },
                {
                    "message": 30,
                    "message2": 31,
                    "unk04": 3,
                    "unk06": -1,
                    "points": -5,
                    "unk0a": -1
                }
            ]
        },
        {
            "turn": 100,
            "unk02": -1,
            "unk04": -1,
            "unk06": -1,
            "reaction": 1,
            "score": 12,
            "messages": [
                [ 32, 34, 36, 38, -1, -1, -1, -1, -1, -1 ],
                [ 33, 35, 37, -1, 39, 40, -1, -1, -1, -1 ]
            ],
            "events": [ 17, -1, -1, 33, 34, -1, -1, -1, -1, -1 ],
            "choices": [
                {
                    "message": -1,
                    "message2": -1,
                    "unk04": -1,
                    "unk06": -1,
                    "points": 0,
                    "unk0a": -1
                },
                {
                    "message": -1,
                    "message2": -1,
                    "unk04": -1,
                    "unk06": -1,
                    "points": 0,
                    "unk0a": -1
                },
                {
                    "message": -1,
                    "message2": -1,
                    "unk04": -1,
                    "unk06": -1,
                    "points": 0,
                    "unk0a": -1
                },
                {
                    "message": -1,
                    "message2": -1,
                    "unk04": -1,
                    "unk06": -1,
                    "points": 0,
                    "unk0a": -1
                }
            ]
        },
        {
            "turn": 101,
            "unk02": -1,
            "unk04": 3,
            "unk06": -1,
            "reaction": 4,
            "score": -50,
            "messages": [
                [ -1, 42, 44, -1, -1, -1, -1, -1, -1, -1 ],
                [ 41, 43, 45, 46, -1, -1, -1, -1, -1, -1 ]
            ],
            "events": [ 17, -1, 18, 34, -1, -1, -1, -1, -1, -1 ],
            "choices": [
                {
                    "message": -1,
                    "message2": -1,
                    "unk04": -1,
                    "unk06": -1,
                    "points": 0,
                    "unk0a": -1
                },
                {
                    "message": -1,
                    "message2": -1,
                    "unk04": -1,
                    "unk06": -1,
                    "points": 0,
                    "unk0a": -1
                },
                {
                    "message": -1,
                    "message2": -1,
                    "unk04": -1,
                    "unk06": -1,
                    "points": 0,
                    "unk0a": -1
                },
                {
                    "message": -1,
                    "message2": -1,
                    "unk04": -1,
                    "unk06": -1,
                    "points": 0,
                    "unk0a": -1
                }
            ]
        },
        {
            "turn": 101,
            "unk02": -1,
            "unk04": -1,
            "unk06": -1,
            "reaction": 4,
            "score": -50,
            "messages": [
                [ 47, 49, 51, -1, -1, -1, -1, -1, -1, -1 ],
                [ 48, 50, 52, 53, -1, -1, -1, -1, -1, -1 ]
            ],
            "events": [ 17, -1, 18, 34, -1, -1, -1, -1, -1, -1 ],
            "choices": [
                {
                    "message": -1,
                    "message2": -1,
                    "unk04": -1,
                    "unk06": -1,
                    "points": 0,
                    "unk0a": -1
                },
                {
                    "message": -1,
                    "message2": -1,
                    "unk04": -1,
                    "unk06": -1,
                    "points": 0,
                    "unk0a": -1
                },
                {
                    "message": -1,
                    "message2": -1,
                    "unk04": -1,
                    "unk06": -1,
                    "points": 0,
                    "unk0a": -1
                },
                {
                    "message": -1,
                    "message2": -1,
                    "unk04": -1,
                    "unk06": -1,
                    "points": 0,
                    "unk0a": -1
                }
            ]
        },
        {
            "turn": 101,
            "unk02": 4,
            "unk04": -1,
            "unk06": -1,
            "reaction": 3,
            "score": 75,
            "messages": [